{"criada_em":"2026-08-23T10:14:00Z","destinatario":{"designacao":"Arquivo Distrital de Exemplo","identificadores":[{"sistema":"pt-dglab","valor":"PT-ADE-017"}]},"fundamento":"Transferência para arquivo definitivo das unidades do proc.º 789/2026, findo o prazo de conservação administrativa no serviço produtor.","inventario":[{"ficheiro":"evidencia/7c9e1a52-3b48-4d6f-9a20-5e8f14b7c063.evidencia.json","hash_sha256":"sha256:e4a7c8c9846c8fd5b00975ddd3e3327fb60d558889d90275515e4a18aa005690"},{"ficheiro":"evidencia/a1b2c3d4-e5f6-4789-abcd-ef0123456789.evidencia.json","hash_sha256":"sha256:c7c93af683f94e0caeac87c6c1cc4c6dc2042a03a9d27fa28686ab87b4c7063a"}],"ndfxfer_version":"1.0.0","referencias_externas":[{"alvo":{"ndf_id":"2d6f80b1-9c47-4a35-8e12-5b90fa73cd48","payload_hash":"sha256:4c1f9a02e7b53d84610cf27a95d3e8b1f60427cda9e3f815b2704d6c8ae19f3b"},"declarada_por":"a1b2c3d4-e5f6-4789-abcd-ef0123456789","tipo":"responde_a"}],"transferencia_id":"b7c19e04-2a55-4f83-9d61-0e7a4c8f2135","transmitente":{"designacao":"Direção-Geral de Exemplo","identificadores":[{"sistema":"pt-dglab","valor":"PT-DGE-000"}]},"unidades":[{"ficheiro":"unidades/oficio-of-2026-00123.ndfpkg","ndf_id":"a1b2c3d4-e5f6-4789-abcd-ef0123456789","payload_hash":"sha256:8e3600426a4e97bcd09dd78f53de37f7d99e332fb61b1ce868468e063304d2c4","validation_code":"NDF-QBMUKIWKOKL2BSY7PN2O"},{"ficheiro":"unidades/requerimento-eb-2026-4471.ndfpkg","ndf_id":"7c9e1a52-3b48-4d6f-9a20-5e8f14b7c063","payload_hash":"sha256:fb4e2a7ef35f0f42853b6fab5450cd8710a87c9f96f3bc8fd108e796fc4c79e9","validation_code":"NDF-PBGWIXDOHWVJPUDFUSKP"}]}